Code,Indicator Name,Short definition,Long definition,Source,Topic
LO.PISA.MAT.6.MA,PISA: Male 15-year-olds by mathematics proficiency level (%). Level 6,"Percentage of 15-year-old male students scoring higher than 669 on the PISA mathematics scale. At Level 6, students can conceptualize, generalize and utilize information based on their investigations and modeling of complex problem situations, and can use their knowledge in relatively non-standard contexts. They can link different information sources and representations and flexibly translate among them. Students at this level are capable of advanced mathematical thinking and reasoning. These students can apply this insight and understanding, along with a mastery of symbolic and formal mathematical operations and relationships, to develop new approaches and strategies for attacking novel situations. Students at this level can reflect on their actions, and can formulate and precisely communicate their actions and reflections regarding their findings, interpretations, arguments, and the appropriateness of these to the original situation. Data reflects country performance in the stated year according to PISA reports, but may not be comparable across years or countries. Consult the PISA website for more detailed information: http://www.oecd.org/pisa/","Percentage of 15-year-old male students scoring higher than 669 on the PISA mathematics scale. At Level 6, students can conceptualize, generalize and utilize information based on their investigations and modeling of complex problem situations, and can use their knowledge in relatively non-standard contexts. They can link different information sources and representations and flexibly translate among them. Students at this level are capable of advanced mathematical thinking and reasoning. These students can apply this insight and understanding, along with a mastery of symbolic and formal mathematical operations and relationships, to develop new approaches and strategies for attacking novel situations. Students at this level can reflect on their actions, and can formulate and precisely communicate their actions and reflections regarding their findings, interpretations, arguments, and the appropriateness of these to the original situation. Data reflects country performance in the stated year according to PISA reports, but may not be comparable across years or countries. Consult the PISA website for more detailed information: http://www.oecd.org/pisa/",OECD Programme for International Student Assessment (PISA),Learning Outcomes
LO.PISA.MAT.5.MA,PISA: Male 15-year-olds by mathematics proficiency level (%). Level 5,"Percentage of 15-year-old male students scoring higher than 607 but lower than or equal to 669 on the PISA mathematics scale. At Level 5, students can develop and work with models for complex situations, identifying constraints and specifying assumptions. They can select, compare, and evaluate appropriate problem-solving strategies for dealing with complex problems related to these models. Students at this level can work strategically using broad, well-developed thinking and reasoning skills, appropriate linked representations, symbolic and formal characterizations, and insight pertaining to these situations. They begin to reflect on their work and can formulate and communicate their interpretations and reasoning. Data reflects country performance in the stated year according to PISA reports, but may not be comparable across years or countries. Consult the PISA website for more detailed information: http://www.oecd.org/pisa/","Percentage of 15-year-old male students scoring higher than 607 but lower than or equal to 669 on the PISA mathematics scale. At Level 5, students can develop and work with models for complex situations, identifying constraints and specifying assumptions. They can select, compare, and evaluate appropriate problem-solving strategies for dealing with complex problems related to these models. Students at this level can work strategically using broad, well-developed thinking and reasoning skills, appropriate linked representations, symbolic and formal characterizations, and insight pertaining to these situations. They begin to reflect on their work and can formulate and communicate their interpretations and reasoning. Data reflects country performance in the stated year according to PISA reports, but may not be comparable across years or countries. Consult the PISA website for more detailed information: http://www.oecd.org/pisa/",OECD Programme for International Student Assessment (PISA),Learning Outcomes
LO.PISA.SCI.0.MA,PISA: Male 15-year-olds by science proficiency level (%). Below Level 1B,,"Percentage of 15-year-old male students scoring below the lowest proficiency level (less than or equal to 261) on the PISA science scale. No item in the PISA assessment can indicate what students who perform below Level 1b can do. Students below Level 1b may have acquired some elements of science knowledge and skills, but based on the tasks included in the PISA test, their ability can only be described in terms of what they cannot do – and they are unlikely to be able to solve, other than by guessing, any of the PISA tasks. Data reflect country performance in the stated year, but may not be comparable across years or countries. Consult the PISA website for more detailed information: http://www.oecd.org/pisa/",OECD Programme for International Student Assessment (PISA),Learning Outcomes
LO.PISA.SCI.1A.MA,PISA: Male 15-year-olds by science proficiency level (%). Level 1A,,"Percentage of 15-year-old male students scoring higher than 335 but less than or equal to 410 on the PISA science scale. At Level 1A, students are able to use basic or everyday content and procedural knowledge to recognise or identify explanations of simple scientific phenomenon. With support, they can undertake structured scientific enquiries with no more than two variables. They are able to identify simple causal or correlational relationships and interpret graphical and visual data that require a low level of cognitive demand. Level 1a students can select the best scientific explanation for given data in familiar personal, local and global contexts. Data reflect country performance in the stated year, but may not be comparable across years or countries. Consult the PISA website for more detailed information: http://www.oecd.org/pisa/",OECD Programme for International Student Assessment (PISA),Learning Outcomes
LO.PISA.SCI.1B.MA,PISA: Male 15-year-olds by science proficiency level (%). Level 1B,,"Percentage of 15-year-old male students scoring higher than 261 but less than or equal to 335 on the PISA science scale. At Level 1B, students can use basic or everyday scientific knowledge to recognise aspects of familiar or simple phenomenon. They are able to identify simple patterns in data, recognise basic scientific terms and follow explicit instructions to carry out a scientific procedure. Data reflect country performance in the stated year, but may not be comparable across years or countries. Consult the PISA website for more detailed information: http://www.oecd.org/pisa/",OECD Programme for International Student Assessment (PISA),Learning Outcomes
LO.PISA.SCI.2.MA,PISA: Male 15-year-olds by science proficiency level (%). Level 2,,"Percentage of 15-year-old male students scoring higher than 410 but less than or equal to 484 on the PISA science scale. At Level 2, students are able to draw on everyday content knowledge and basic procedural knowledge to identify an appropriate scientific explanation, interpret data, and identify the question being addressed in a simple experimental design. They can use basic or everyday scientific knowledge to identify a valid conclusion from a simple data set. Level 2 students demonstrate basic epistemic knowledge by being able to identify questions that can be investigated scientifically. Data reflect country performance in the stated year, but may not be comparable across years or countries. Consult the PISA website for more detailed information: http://www.oecd.org/pisa/",OECD Programme for International Student Assessment (PISA),Learning Outcomes
LO.PISA.SCI.3.MA,PISA: Male 15-year-olds by science proficiency level (%). Level 3,,"Percentage of 15-year-old male students scoring higher than 484 but less than or equal to 559 on the PISA science scale. At Level 3, students can draw upon moderately complex content knowledge to identify or construct explanations of familiar phenomena. In less familiar or more complex situations, they can construct explanations with relevant cueing or support. They can draw on elements of procedural or epistemic knowledge to carry out a simple experiment in a constrained context. Level 3 students are able to distinguish between scientific and non-scientific issues and identify the evidence supporting a scientific claim. Data reflect country performance in the stated year, but may not be comparable across years or countries. Consult the PISA website for more detailed information: http://www.oecd.org/pisa/",OECD Programme for International Student Assessment (PISA),Learning Outcomes
LO.PISA.SCI.4.MA,PISA: Male 15-year-olds by science proficiency level (%). Level 4,,"Percentage of 15-year-old male students scoring higher than 559 but less than or equal to 633 on the PISA science scale. At Level 4, students can use more complex or more abstract content knowledge, which is either provided or recalled, to construct explanations of more complex or less familiar events and processes. They can conduct experiments involving two or more independent variables in a constrained context. They are able to justify an experimental design, drawing on elements of procedural and epistemic knowledge. Level 4 students can interpret data drawn from a moderately complex data set or less familiar context, draw appropriate conclusions that go beyond the data and provide justifications for their choices. Data reflect country performance in the stated year, but may not be comparable across years or countries. Consult the PISA website for more detailed information: http://www.oecd.org/pisa/",OECD Programme for International Student Assessment (PISA),Learning Outcomes
LO.PISA.SCI.5.MA,PISA: Male 15-year-olds by science proficiency level (%). Level 5,,"Percentage of 15-year-old male students scoring higher than 633 but less than or equal to 708 on the PISA science scale. At Level 5, students can use abstract scientific ideas or concepts to explain unfamiliar and more complex phenomena, events and processes involving multiple causal links. They are able to apply more sophisticated epistemic knowledge to evaluate alternative experimental designs and justify their choices and use theoretical knowledge to interpret information or make predictions. Level 5 students can evaluate ways of exploring a given question scientifically and identify limitations in interpretations of data sets including sources and the effects of uncertainty in scientific data. Data reflect country performance in the stated year, but may not be comparable across years or countries. Consult the PISA website for more detailed information: http://www.oecd.org/pisa/",OECD Programme for International Student Assessment (PISA),Learning Outcomes
LO.PISA.SCI.6.MA,PISA: Male 15-year-olds by science proficiency level (%). Level 6,,"Percentage of 15-year-old male students scoring higher than 708 on the PISA science scale. At Level 6, students can draw on a range of interrelated scientific ideas and concepts from the physical, life and earth and space sciences and use content, procedural and epistemic knowledge in order to offer explanatory hypotheses of novel scientific phenomena, events and processes or to make predictions. In interpreting data and evidence, they are able to discriminate between relevant and irrelevant information and can draw on knowledge external to the normal school curriculum. They can distinguish between arguments that are based on scientific evidence and theory and those based on other considerations. Level 6 students can evaluate competing designs of complex experiments, field studies or simulations and justify their choices. Data reflect country performance in the stated year, but may not be comparable across years or countries. Consult the PISA website for more detailed information: http://www.oecd.org/pisa/",OECD Programme for International Student Assessment (PISA),Learning Outcomes
